{
  "schemaVersion": 1,
  "releaseId": "release.wild_renewal.v1.skeleton",
  "releaseVersion": "1.0.0",
  "worlds": [
    {
      "id": "world.wild_renewal",
      "nameKey": "world.wild_renewal.name",
      "summaryKey": "world.wild_renewal.summary",
      "roleKey": "world.wild_renewal.role.waykeeper",
      "hubNameKey": "world.wild_renewal.hub.hearthwild",
      "sagaIds": [
        "saga.wild_renewal.quiet_bloom"
      ]
    }
  ],
  "sagas": [
    {
      "id": "saga.wild_renewal.quiet_bloom",
      "worldId": "world.wild_renewal",
      "titleKey": "saga.wild_renewal.quiet_bloom.title",
      "summaryKey": "saga.wild_renewal.quiet_bloom.summary",
      "chapterIds": [
        "chapter.wr.01.empty_hearth",
        "chapter.wr.02.footprints_moss",
        "chapter.wr.03.workshop_wakes",
        "chapter.wr.04.voices_return",
        "chapter.wr.05.faded_grove",
        "chapter.wr.06.long_rain",
        "chapter.wr.07.roots_remember",
        "chapter.wr.08.quiet_bloom"
      ],
      "postSagaStateKey": "world.wild_renewal.state.quiet_bloom_complete"
    }
  ],
  "chapters": [
    {
      "id": "chapter.wr.01.empty_hearth",
      "sagaId": "saga.wild_renewal.quiet_bloom",
      "titleKey": "chapter.wr.01.title",
      "summaryKey": "chapter.wr.01.summary",
      "prerequisiteChapterIds": [],
      "entryNodeId": "chapter.wr.01.empty_hearth.open",
      "completionNodeId": "chapter.wr.01.empty_hearth.complete",
      "objectiveHooks": [
        "action"
      ],
      "requiredFeatures": [
        "action",
        "world_structure",
        "chronicle"
      ],
      "nodes": [
        {
          "id": "chapter.wr.01.empty_hearth.open",
          "kind": "opening",
          "localizationKey": "chapter.wr.01.node.open",
          "nextNodeIds": [
            "chapter.wr.01.empty_hearth.objective"
          ],
          "npcIds": [
            "npc.wr.wayfinder"
          ],
          "companionIds": [],
          "worldStructureIds": [],
          "rewardIds": [],
          "chronicleTriggerIds": []
        },
        {
          "id": "chapter.wr.01.empty_hearth.objective",
          "kind": "objective",
          "localizationKey": "chapter.wr.01.node.objective",
          "nextNodeIds": [
            "chapter.wr.01.empty_hearth.complete"
          ],
          "npcIds": [
            "npc.wr.wayfinder"
          ],
          "companionIds": [],
          "worldStructureIds": [],
          "rewardIds": [],
          "chronicleTriggerIds": []
        },
        {
          "id": "chapter.wr.01.empty_hearth.complete",
          "kind": "completion",
          "localizationKey": "chapter.wr.01.node.complete",
          "nextNodeIds": [],
          "npcIds": [
            "npc.wr.wayfinder"
          ],
          "companionIds": [],
          "worldStructureIds": [
            "structure.wr.central_hearth"
          ],
          "rewardIds": [
            "reward.chapter.standard"
          ],
          "chronicleTriggerIds": [
            "chronicle.wr.first_hearth"
          ]
        }
      ]
    },
    {
      "id": "chapter.wr.02.footprints_moss",
      "sagaId": "saga.wild_renewal.quiet_bloom",
      "titleKey": "chapter.wr.02.title",
      "summaryKey": "chapter.wr.02.summary",
      "prerequisiteChapterIds": [
        "chapter.wr.01.empty_hearth"
      ],
      "entryNodeId": "chapter.wr.02.footprints_moss.open",
      "completionNodeId": "chapter.wr.02.footprints_moss.complete",
      "objectiveHooks": [
        "habit"
      ],
      "requiredFeatures": [
        "habit",
        "companion",
        "world_structure"
      ],
      "nodes": [
        {
          "id": "chapter.wr.02.footprints_moss.open",
          "kind": "opening",
          "localizationKey": "chapter.wr.02.node.open",
          "nextNodeIds": [
            "chapter.wr.02.footprints_moss.objective"
          ],
          "npcIds": [
            "npc.wr.wayfinder"
          ],
          "companionIds": [],
          "worldStructureIds": [],
          "rewardIds": [],
          "chronicleTriggerIds": []
        },
        {
          "id": "chapter.wr.02.footprints_moss.objective",
          "kind": "objective",
          "localizationKey": "chapter.wr.02.node.objective",
          "nextNodeIds": [
            "chapter.wr.02.footprints_moss.complete"
          ],
          "npcIds": [
            "npc.wr.wayfinder"
          ],
          "companionIds": [
            "companion.wr.leafglow_fox"
          ],
          "worldStructureIds": [],
          "rewardIds": [],
          "chronicleTriggerIds": []
        },
        {
          "id": "chapter.wr.02.footprints_moss.complete",
          "kind": "completion",
          "localizationKey": "chapter.wr.02.node.complete",
          "nextNodeIds": [],
          "npcIds": [
            "npc.wr.wayfinder"
          ],
          "companionIds": [
            "companion.wr.leafglow_fox"
          ],
          "worldStructureIds": [
            "structure.wr.moss_path"
          ],
          "rewardIds": [
            "reward.chapter.standard"
          ],
          "chronicleTriggerIds": [
            "chronicle.wr.first_companion"
          ]
        }
      ]
    },
    {
      "id": "chapter.wr.03.workshop_wakes",
      "sagaId": "saga.wild_renewal.quiet_bloom",
      "titleKey": "chapter.wr.03.title",
      "summaryKey": "chapter.wr.03.summary",
      "prerequisiteChapterIds": [
        "chapter.wr.02.footprints_moss"
      ],
      "entryNodeId": "chapter.wr.03.workshop_wakes.open",
      "completionNodeId": "chapter.wr.03.workshop_wakes.complete",
      "objectiveHooks": [
        "campaign_phase"
      ],
      "requiredFeatures": [
        "quest",
        "campaign",
        "campaign_phase",
        "world_structure"
      ],
      "nodes": [
        {
          "id": "chapter.wr.03.workshop_wakes.open",
          "kind": "opening",
          "localizationKey": "chapter.wr.03.node.open",
          "nextNodeIds": [
            "chapter.wr.03.workshop_wakes.objective"
          ],
          "npcIds": [
            "npc.wr.crafter"
          ],
          "companionIds": [],
          "worldStructureIds": [],
          "rewardIds": [],
          "chronicleTriggerIds": []
        },
        {
          "id": "chapter.wr.03.workshop_wakes.objective",
          "kind": "objective",
          "localizationKey": "chapter.wr.03.node.objective",
          "nextNodeIds": [
            "chapter.wr.03.workshop_wakes.complete"
          ],
          "npcIds": [
            "npc.wr.crafter"
          ],
          "companionIds": [],
          "worldStructureIds": [],
          "rewardIds": [],
          "chronicleTriggerIds": []
        },
        {
          "id": "chapter.wr.03.workshop_wakes.complete",
          "kind": "completion",
          "localizationKey": "chapter.wr.03.node.complete",
          "nextNodeIds": [],
          "npcIds": [
            "npc.wr.crafter"
          ],
          "companionIds": [],
          "worldStructureIds": [
            "structure.wr.workshop"
          ],
          "rewardIds": [
            "reward.chapter.major"
          ],
          "chronicleTriggerIds": [
            "chronicle.wr.workshop_wakes"
          ]
        }
      ]
    },
    {
      "id": "chapter.wr.04.voices_return",
      "sagaId": "saga.wild_renewal.quiet_bloom",
      "titleKey": "chapter.wr.04.title",
      "summaryKey": "chapter.wr.04.summary",
      "prerequisiteChapterIds": [
        "chapter.wr.03.workshop_wakes"
      ],
      "entryNodeId": "chapter.wr.04.voices_return.open",
      "completionNodeId": "chapter.wr.04.voices_return.complete",
      "objectiveHooks": [
        "life_skill"
      ],
      "requiredFeatures": [
        "life_skill",
        "npc_relationship",
        "rest_period",
        "world_structure"
      ],
      "nodes": [
        {
          "id": "chapter.wr.04.voices_return.open",
          "kind": "opening",
          "localizationKey": "chapter.wr.04.node.open",
          "nextNodeIds": [
            "chapter.wr.04.voices_return.objective"
          ],
          "npcIds": [
            "npc.wr.gardener"
          ],
          "companionIds": [],
          "worldStructureIds": [],
          "rewardIds": [],
          "chronicleTriggerIds": []
        },
        {
          "id": "chapter.wr.04.voices_return.objective",
          "kind": "objective",
          "localizationKey": "chapter.wr.04.node.objective",
          "nextNodeIds": [
            "chapter.wr.04.voices_return.complete"
          ],
          "npcIds": [
            "npc.wr.gardener",
            "npc.wr.caretaker"
          ],
          "companionIds": [],
          "worldStructureIds": [],
          "rewardIds": [],
          "chronicleTriggerIds": []
        },
        {
          "id": "chapter.wr.04.voices_return.complete",
          "kind": "completion",
          "localizationKey": "chapter.wr.04.node.complete",
          "nextNodeIds": [],
          "npcIds": [
            "npc.wr.caretaker"
          ],
          "companionIds": [],
          "worldStructureIds": [
            "structure.wr.gathering_place"
          ],
          "rewardIds": [
            "reward.chapter.standard"
          ],
          "chronicleTriggerIds": [
            "chronicle.wr.voices_return"
          ]
        }
      ]
    },
    {
      "id": "chapter.wr.05.faded_grove",
      "sagaId": "saga.wild_renewal.quiet_bloom",
      "titleKey": "chapter.wr.05.title",
      "summaryKey": "chapter.wr.05.summary",
      "prerequisiteChapterIds": [
        "chapter.wr.04.voices_return"
      ],
      "entryNodeId": "chapter.wr.05.faded_grove.open",
      "completionNodeId": "chapter.wr.05.faded_grove.complete",
      "objectiveHooks": [
        "campaign"
      ],
      "requiredFeatures": [
        "campaign",
        "companion",
        "world_structure"
      ],
      "nodes": [
        {
          "id": "chapter.wr.05.faded_grove.open",
          "kind": "opening",